<?xml version="1.0" encoding="UTF-8"?>

<!-- generated on Thu Apr 18 00:13:39 2019 by Eclipse SUMO netconvert Version v1_2_0+0017-2a947141e5
This data file and the accompanying materials
are made available under the terms of the Eclipse Public License v2.0
which accompanies this distribution, and is available at
http://www.eclipse.org/legal/epl-v20.html
SPDX-License-Identifier: EPL-2.0
<configuration xmlns:xsi="http://www.w3.org/2001/XMLSchema-instance" xsi:noNamespaceSchemaLocation="http://sumo.dlr.de/xsd/netconvertConfiguration.xsd">

    <input>
        <osm-files value="osm.xml"/>
    </input>

    <output>
        <write-license value="true"/>
        <output-file value="net.net.xml"/>
        <plain-output-prefix value="plain"/>
        <output.street-names value="true"/>
    </output>

    <projection>
        <proj.utm value="true"/>
        <proj.plain-geo value="true"/>
    </projection>

    <tls_building>
        <tls.red.time value="10"/>
    </tls_building>

    <junctions>
        <no-internal-links value="true"/>
    </junctions>

    <report>
        <verbose value="true"/>
    </report>

</configuration>
-->

<types version="1.1" xmlns:xsi="http://www.w3.org/2001/XMLSchema-instance" xsi:noNamespaceSchemaLocation="http://sumo.dlr.de/xsd/types_file.xsd">
    <type id="highway.bridleway" priority="1" numLanes="1" speed="2.78" allow="pedestrian" oneway="1" width="2.00"/>
    <type id="highway.bus_guideway" priority="1" numLanes="1" speed="27.78" allow="bus" oneway="1"/>
    <type id="highway.cycleway" priority="1" numLanes="1" speed="8.33" allow="bicycle" oneway="0" width="1.00"/>
    <type id="highway.footway" priority="1" numLanes="1" speed="2.78" allow="pedestrian" oneway="1" width="2.00"/>
    <type id="highway.ford" priority="1" numLanes="1" speed="2.78" allow="army" oneway="0"/>
    <type id="highway.living_street" priority="2" numLanes="1" speed="2.78" disallow="tram rail_urban rail rail_electric ship" oneway="0"/>
    <type id="highway.motorway" priority="14" numLanes="2" speed="39.44" allow="private emergency authority army vip passenger hov taxi bus coach delivery truck trailer motorcycle evehicle custom1 custom2" oneway="1"/>
    <type id="highway.motorway_link" priority="9" numLanes="1" speed="22.22" allow="private emergency authority army vip passenger hov taxi bus coach delivery truck trailer motorcycle evehicle custom1 custom2" oneway="1"/>
    <type id="highway.path" priority="1" numLanes="1" speed="2.78" allow="bicycle pedestrian" oneway="1" width="2.00"/>
    <type id="highway.pedestrian" priority="1" numLanes="1" speed="2.78" allow="pedestrian" oneway="1" width="2.00"/>
    <type id="highway.primary" priority="12" numLanes="2" speed="27.78" disallow="tram rail_urban rail rail_electric ship" oneway="0"/>
    <type id="highway.primary_link" priority="7" numLanes="1" speed="22.22" disallow="tram rail_urban rail rail_electric ship" oneway="0"/>
    <type id="highway.raceway" priority="15" numLanes="2" speed="83.33" allow="vip" oneway="0"/>
    <type id="highway.residential" priority="3" numLanes="1" speed="13.89" disallow="tram rail_urban rail rail_electric ship" oneway="0"/>
    <type id="highway.secondary" priority="11" numLanes="2" speed="27.78" disallow="tram rail_urban rail rail_electric ship" oneway="0"/>
    <type id="highway.secondary_link" priority="6" numLanes="1" speed="22.22" disallow="tram rail_urban rail rail_electric ship" oneway="0"/>
    <type id="highway.service" priority="1" numLanes="1" speed="5.56" allow="delivery bicycle pedestrian" oneway="0"/>
    <type id="highway.stairs" priority="1" numLanes="1" speed="1.39" allow="pedestrian" oneway="1" width="2.00"/>
    <type id="highway.step" priority="1" numLanes="1" speed="1.39" allow="pedestrian" oneway="1" width="2.00"/>
    <type id="highway.steps" priority="1" numLanes="1" speed="1.39" allow="pedestrian" oneway="1" width="2.00"/>
    <type id="highway.tertiary" priority="10" numLanes="1" speed="22.22" disallow="tram rail_urban rail rail_electric ship" oneway="0"/>
    <type id="highway.tertiary_link" priority="5" numLanes="1" speed="22.22" disallow="tram rail_urban rail rail_electric ship" oneway="0"/>
    <type id="highway.track" priority="1" numLanes="1" speed="5.56" disallow="tram rail_urban rail rail_electric ship" oneway="0"/>
    <type id="highway.trunk" priority="13" numLanes="2" speed="27.78" disallow="tram rail_urban rail rail_electric bicycle pedestrian ship" oneway="0"/>
    <type id="highway.trunk_link" priority="8" numLanes="1" speed="22.22" disallow="tram rail_urban rail rail_electric bicycle pedestrian ship" oneway="0"/>
    <type id="highway.unclassified" priority="4" numLanes="1" speed="13.89" disallow="tram rail_urban rail rail_electric ship" oneway="0"/>
    <type id="highway.unsurfaced" priority="1" numLanes="1" speed="8.33" disallow="tram rail_urban rail rail_electric ship" oneway="0"/>
    <type id="railway.light_rail" priority="19" numLanes="1" speed="27.78" allow="rail_urban" oneway="1"/>
    <type id="railway.preserved" priority="16" numLanes="1" speed="27.78" allow="rail" oneway="1"/>
    <type id="railway.rail" priority="20" numLanes="1" speed="83.33" allow="rail rail_electric" oneway="1"/>
    <type id="railway.subway" priority="18" numLanes="1" speed="27.78" allow="rail_urban" oneway="1"/>
    <type id="railway.tram" priority="17" numLanes="1" speed="13.89" allow="tram" oneway="1"/>

</types>
