<types xmlns:xsi="http://www.w3.org/2001/XMLSchema-instance" xsi:noNamespaceSchemaLocation="http://sumo.dlr.de/xsd/types_file.xsd">
    <type id="highway.primary"        sidewalkWidth="3" disallow="pedestrian rail rail_urban rail_electric tram ship"/>
    <type id="highway.primary_link"   sidewalkWidth="3" disallow="pedestrian rail rail_urban rail_electric tram ship"/>
    <type id="highway.secondary"      sidewalkWidth="3" disallow="pedestrian rail rail_urban rail_electric tram ship"/>
    <type id="highway.secondary_link" sidewalkWidth="3" disallow="pedestrian rail rail_urban rail_electric tram ship"/>
    <type id="highway.tertiary"       sidewalkWidth="3" disallow="pedestrian rail rail_urban rail_electric tram ship"/>
    <type id="highway.tertiary_link"  sidewalkWidth="2" disallow="pedestrian rail rail_urban rail_electric tram ship"/>
    <type id="highway.unclassified"   sidewalkWidth="2" disallow="pedestrian rail rail_urban rail_electric tram ship"/>
    <type id="highway.residential"    sidewalkWidth="2" disallow="pedestrian rail rail_urban rail_electric tram ship"/>
</types>
